id_str,posted_by,created_at,full_text
1786165020235075926,CBSNews,Thu May 02 22:45:00 +0000 2024,The candidate who finished first in the Republican nomination primary race for a North Carolina congressional seat says she\s suspending her campaign, citing her rival\s endorsement by former President Donald Trump in the runoff election. https://t.co/FXK7eGbMp3
1786168795981046027,CBSNews,Thu May 02 23:00:01 +0000 2024,Heather Pressdee, the Pennsylvania nurse charged with killing multiple nursing home residents and trying to kill more than a dozen others, pleaded guilty in court Thursday morning. https://t.co/5cIolxu0Zi
1786170363098829042,CBSNews,Thu May 02 23:06:14 +0000 2024,RT @CBSEveningNews: Florida police officers and a courageous good Samaritan who swiftly responded to a burning home in Cape Coral were hono…
1786170372519235727,CBSNews,Thu May 02 23:06:16 +0000 2024,RT @CBSEveningNews: Trillions of cicadas are emerging from the Midwest to the East Coast after spending more than a decade underground. In…
1786170380396187950,CBSNews,Thu May 02 23:06:18 +0000 2024,RT @CBSEveningNews: The average rate on a 30-year mortgage increased by a fraction to more than 7.2% — the highest level in more than five…
1786170389107794308,CBSNews,Thu May 02 23:06:20 +0000 2024,RT @CBSEveningNews: The body of a fifth construction worker killed in the Baltimore Francis Scott Key Bridge collapse has been recovered fr…
1786170399169949747,CBSNews,Thu May 02 23:06:23 +0000 2024,RT @CBSEveningNews: Rep. Marjorie Taylor Greene says she plans to move forward with an effort to remove House Speaker Mike Johnson. In an u…
1786170424016945241,CBSNews,Thu May 02 23:06:29 +0000 2024,RT @CBSEveningNews: Nearly 40 million people in Texas are on alert for flash flooding after days of torrential rain and severe weather poun…
1786170436343984224,CBSNews,Thu May 02 23:06:32 +0000 2024,RT @CBSEveningNews: Arizona Gov. Katie Hobbs signed a bill repealing an 1864 law that had effectively banned nearly all abortions in the st…
1786170444933988510,CBSNews,Thu May 02 23:06:34 +0000 2024,RT @CBSEveningNews: Interstate 95 in Norwalk, Connecticut will remain closed for several days following a fiery multi-vehicle crash involvi…
1786170454111027251,CBSNews,Thu May 02 23:06:36 +0000 2024,RT @CBSEveningNews: Police used rubber bullets and flash bangs overnight at UCLA to disperse groups of protesters and dismantle on-campus e…
1786170462617170014,CBSNews,Thu May 02 23:06:38 +0000 2024,RT @CBSEveningNews: “There\s the right to protest, but not the right to cause chaos,” President Biden said Thursday regarding the violence…
1786173832547422569,CBSNews,Thu May 02 23:20:01 +0000 2024,RT @CBSEveningNews: Stormy Daniels\ former Attorney Keith Davidson testified in Donald Trump\s New York criminal trial on Thursday, reveali…
1786178859039130018,CBSNews,Thu May 02 23:40:00 +0000 2024,I-95 in Norwalk, Connecticut is closed in both directions and may not reopen for days after a fuel truck crashed and burst into flames under an overpass Thursday morning. https://t.co/qo1d4gFA6V
1786183894791868738,CBSNews,Fri May 03 00:00:00 +0000 2024,Russian military personnel entered an airbase in Niger where some U.S. troops are located, two U.S. officials confirmed to CBS News. https://t.co/R1b4uwMDUL
1786188925792403892,CBSNews,Fri May 03 00:20:00 +0000 2024,New Jersey Sen. Bob Menendez wants a psychiatrist to testify about his habit of stockpiling cash, his attorneys said Wednesday. https://t.co/EUAMXSaJir
1786193961566024150,CBSNews,Fri May 03 00:40:00 +0000 2024,Peloton, known for its tech-enabled stationary bikes and treadmills, announced its CEO is stepping down from his roles as CEO, president and board director. The company also announced it is cutting 15% of its staff or 400 employees. https://t.co/mc2w6SEohN
1786194465129938953,CBSNews,Fri May 03 00:42:01 +0000 2024,CBS News investigation: Republican Rep. Troy Nehls of Texas made claims about his military career that contradict official documents. https://t.co/NZ6J2qRk0m
1786215842448887959,CBSNews,Fri May 03 02:06:57 +0000 2024,The second week of former president Donald Trump’s criminal “hush money” trial saw potential gag order violations and a testimony from the lawyer who represented Karen McDougal and Stormy Daniels at the time of the alleged payments. https://t.co/blbRwRrKTC https://t.co/47cJVQ6gtq
1786222898723590411,CBSNews,Fri May 03 02:35:00 +0000 2024,An orangutan named Rakus appeared to treat a wound with medicine from a tropical plant— the latest example of how some animals attempt to soothe their own ills with remedies, according to a new study. https://t.co/Nrko1ivHED https://t.co/VkNwVFZunG
1786225515243683970,CBSNews,Fri May 03 02:45:23 +0000 2024,At least 1 dead, 1 injured in house explosion in New Jersey. Watch video over the scene. https://t.co/GWuGEgLTem
1786230451981435390,CBSNews,Fri May 03 03:05:00 +0000 2024,Extreme heat is expected in the U.S. this summer. Here’s where hotter-than-normal temperatures are likely. https://t.co/vaGMu8LhGy
1786237998582915269,CBSNews,Fri May 03 03:35:00 +0000 2024,A rare white killer whale nicknamed \Frosty\ was spotted off the California coast. https://t.co/IhDn9r5ouN
1786245549886185595,CBSNews,Fri May 03 04:05:00 +0000 2024,A 9-year-old\s heroic act saves his parents after a recent Oklahoma tornado: \Please don\t die, I will be back\ https://t.co/WnLgTeRUgp
1786260649766465649,CBSNews,Fri May 03 05:05:00 +0000 2024,An orphaned bear cub is doing well two weeks after she was pulled from a tree by a group of people apparently looking to take pictures with her, an animal rescue said. https://t.co/U7QDY1hpNz
1786273124167643353,FoxNews,Fri May 03 05:54:34 +0000 2024,Trump slams \radical left lunatics\ creating chaos on college campuses nationwide https://t.co/uIrBLmqUWT
1786274490319511857,CBSNews,Fri May 03 06:00:00 +0000 2024,The last Neanderthals mysteriously died out around 40,000 years ago, just a few thousand years after humans arrived. The latest discovery is thought to be the best preserved Neanderthal find this century. https://t.co/tkf440uDxg https://t.co/2SbJGX3k58
1786276115796947347,FoxNews,Fri May 03 06:06:28 +0000 2024,Faith Hill shares ‘Yellowstone’-inspired video in honor of Tim McGraw: \Perks of being Mrs. McGraw\ https://t.co/Hq4vHx2kCZ
1786278117331345781,FoxNews,Fri May 03 06:14:25 +0000 2024,Emily Blunt admits new technology is ‘something we’re all nervous about’ https://t.co/Ipxsjj6UHf
1786280273551806546,FoxNews,Fri May 03 06:22:59 +0000 2024,Opinion | I had 8 abortions, but Georgia’s heartbeat law saved my son’s life https://t.co/VUDXaL4rMo
1786282371509100951,FoxNews,Fri May 03 06:31:19 +0000 2024,Anti-McCarthy GOP rebels distance themselves from push to oust Speaker Johnson https://t.co/41ukjVHbRq
1786284383986479254,FoxNews,Fri May 03 06:39:19 +0000 2024,Biden calls Japan \xenophobic\ for not accepting many immigrants, compares to China, Russia https://t.co/J8xNAKXeSj
1786286414017048955,FoxNews,Fri May 03 06:47:23 +0000 2024,Rutgers students counter anti-Israel agitators on campus by waving American flag, chanting \USA! USA!\ https://t.co/oFHtrMrmt1
1786288418718208003,FoxNews,Fri May 03 06:55:21 +0000 2024,California Democrats vulnerable after Schiff, LA mayor victims of crime: \If they’re not safe, who is?\ https://t.co/wNGIFzFhkF
1786289589612683318,CBSNews,Fri May 03 07:00:00 +0000 2024,Employer who fired 78-year-old receptionist must now pay her $78,000 https://t.co/lIwEcsMFgt
1786290373402226979,FoxNews,Fri May 03 07:03:07 +0000 2024,NY v Trump to resume with gag order hearing after Trump fined $9K, threatened with jail time https://t.co/t0MY97e7jv
1786292369433796823,FoxNews,Fri May 03 07:11:03 +0000 2024,Sen. Tom Cotton takes aim at student loan forgiveness for anti-Israel agitators https://t.co/U02l2a3SQt
1786294221558694268,FoxNews,Fri May 03 07:18:24 +0000 2024,House Dem says Americans should be \deeply concerned\ by anti-Israel protests: \We should all be outraged\ https://t.co/3J9HQe8CNa
1786296064271618530,FoxNews,Fri May 03 07:25:44 +0000 2024,Sen Mike Lee targets university grants, cites \woke DEI programs,\ anti-Israel riots https://t.co/hXrDJZcB0V
1786304690348523844,CBSNews,Fri May 03 08:00:00 +0000 2024,The IRS says it is about to ramp up audits as it cracks down on tax cheats and seeks to deliver more revenue into the U.S. Treasury\s coffers. https://t.co/wdEIvVyxdN https://t.co/D2K2w40eLs
1786306530704269328,FoxNews,Fri May 03 08:07:19 +0000 2024,US can learn from controversial UK policy as first migrants rounded up for deportation, expert says https://t.co/L801mdXRIJ
1786308473937908219,FoxNews,Fri May 03 08:15:02 +0000 2024,VP Stakes: Trump meeting with potential running mates this weekend https://t.co/j4nXrnRwoW
1786310432703078840,FoxNews,Fri May 03 08:22:49 +0000 2024,Charlotte shootout: 4 slain officers serving warrant had \great disadvantage,\ expert says https://t.co/bpFSBCoYbe
1786312362909110377,FoxNews,Fri May 03 08:30:30 +0000 2024,FLASHBACK: Biden confidante made revealing admission about Obama DOJ in unearthed interview https://t.co/ELevg1IxuH
1786314242884309436,FoxNews,Fri May 03 08:37:58 +0000 2024,Michigan researchers discover eerie 1909 shipwreck at bottom of Lake Superior https://t.co/W3SIVJ8Qe1
1786316192417800702,FoxNews,Fri May 03 08:45:43 +0000 2024,Bob Baffert vs Churchill Downs: A timeline of why the Hall of Fame trainer will miss another Kentucky Derby https://t.co/U5C6F86D66
1786318142412660902,FoxNews,Fri May 03 08:53:27 +0000 2024,Country star Walker Hayes on what brought his family back together after tragedy https://t.co/au5RDaKb7M
1786319789536772194,CBSNews,Fri May 03 09:00:00 +0000 2024,MS-13 gang leader who prosecutors say turned D.C. area into \hunting ground\ sentenced to life in prison https://t.co/zIaqtXw4nb
1786320070408380753,FoxNews,Fri May 03 09:01:07 +0000 2024,Johnny Depp\s comeback movie is ‘brilliant move’ but Hollywood future ‘uncertain’: expert https://t.co/kgtXUnEWRt
1786321981089988976,FoxNews,Fri May 03 09:08:43 +0000 2024,Are noise-canceling headphones hazardous to your health? Audiology experts share warnings https://t.co/BtkBmBV2sf
1786324088346034514,FoxNews,Fri May 03 09:17:05 +0000 2024,Opinion | NY vs. Trump: DA Bragg\s web of deceit starts to unravel https://t.co/AWLPjmwd15
1786326105021993308,FoxNews,Fri May 03 09:25:06 +0000 2024,Opinion | I asked Congress to stop a ‘Big Brother’ power grab that victimizes small businesses https://t.co/yilaNG0GAL
1786327336960331856,CBSNews,Fri May 03 09:30:00 +0000 2024,An NYPD officer fired his gun inside Hamilton Hall during Tuesday night\s operation at Columbia University, the Manhattan district attorney\s office confirmed. https://t.co/WtTmvXeyXC
1786328218053595385,FoxNews,Fri May 03 09:33:30 +0000 2024,Biden brings up Islamophobia amid the worst antisemitism outbreak in decades https://t.co/b8Gzqhjjbu
1786330338693660764,FoxNews,Fri May 03 09:41:55 +0000 2024,TikTok influencer torches ‘very harmful’ social media platform for fueling anti-Israel campus riots https://t.co/eeY9OnPGZq
1786332400890360291,FoxNews,Fri May 03 09:50:07 +0000 2024,MIT researcher visits encampment, condemns anti-Israel protests and school leaders: ‘We are being harassed’ https://t.co/QVFGYbar79
1786334484712882599,FoxNews,Fri May 03 09:58:24 +0000 2024,Stanford Jewish students on taking photo of man with Hamas headband on campus: \We were just in shock\ https://t.co/XTubOW0WR0
1786334887680544857,CBSNews,Fri May 03 10:00:00 +0000 2024,Summer heat has arrived early across South and Southeast Asia, setting records and even claiming lives. It\s expected to get much worse through May and June. https://t.co/VhDLRZHtzK https://t.co/OqlYhpQ0Tb
1786336847804690858,FoxNews,Fri May 03 10:07:47 +0000 2024,UNC frat brothers who defended US flag speak out: \Deeply important to us\ https://t.co/fU7hF8qmfK
1786338684159082977,FoxNews,Fri May 03 10:15:05 +0000 2024,NY v Trump: Remaining alleged gag order violations hang in balance as trial resumes https://t.co/jJgIdqpKg3
1786340598045135345,FoxNews,Fri May 03 10:22:41 +0000 2024,How to shut down Facebook’s nosy ‘People You May Know’ suggestions https://t.co/1on20BVQ3U
1786342438757417383,CBSNews,Fri May 03 10:30:00 +0000 2024,Roughly 100,000 people who were brought to the U.S. as children are expected to enroll in the Affordable Care Act\s health insurance next year under a new directive from the Biden administration. https://t.co/tEAuGtFKC3
1786342472429322450,FoxNews,Fri May 03 10:30:08 +0000 2024,Where is Shafik? Columbia University president keeps low profile, fights to keep job amid campus antisemitism https://t.co/wC5vVhX1Vx
1786344308066365673,FoxNews,Fri May 03 10:37:26 +0000 2024,AJ Styles \ready to rock\ as he gets post-WrestleMania title shot against Cody Rhodes at Backlash https://t.co/604GDDeJf8
1786346231553282177,FoxNews,Fri May 03 10:45:04 +0000 2024,Opinion | Antifa returns with a vengeance in college mobs. Here’s what the future holds https://t.co/BMCH7qb4mE
1786348264544944337,FoxNews,Fri May 03 10:53:09 +0000 2024,Fired CNN contributor says he told his kid to join anti-Israeli campus protests and ‘tear some s--- up\ https://t.co/lAiJTxfDOm
1786349992212402666,CBSNews,Fri May 03 11:00:01 +0000 2024,Pres. Biden will award the Presidential Medal of Freedom to 19 recipients, including fmr. House Speaker Nancy Pelosi, fmr. Vice President Al Gore and Olympic swimmer Katie Ledecky.  https://t.co/3ZzMz4fIka
1786350088802955399,FoxNews,Fri May 03 11:00:24 +0000 2024,Police arrest 30 at Portland State University after anti-Israel agitators occupy library twice in one day https://t.co/uW6A7lr6Mc
1786352335360303449,FoxNews,Fri May 03 11:09:20 +0000 2024,Recipes for your Kentucky Derby party https://t.co/3D2E2EWZzk
1786353792230838290,FoxNews,Fri May 03 11:15:07 +0000 2024,College girl pelted with objects by anti-Israel protesters for standing up for US flag speaks out https://t.co/Aql44LKF6r
1786355711527493771,FoxNews,Fri May 03 11:22:45 +0000 2024,Black student erupts on anti-Israel \White libs\ for blocking path on campus: \Cosplaying as the oppressed\ https://t.co/2BmOaKZFY1
1786357537786179723,CBSNews,Fri May 03 11:30:00 +0000 2024,China has launched a lunar probe to land on the far side of the moon in a first-of-its-kind mission to return with samples that could provide insights into differences between the less-explored region and the better-known near side. https://t.co/lZ8bC7sDhH
1786357591288717318,FoxNews,Fri May 03 11:30:13 +0000 2024,Biden ripped for decrying \Islamophobia\ amid antisemitic campus protests: \Yet another equivocation\ https://t.co/gzivd6PzPR
1786359400556282214,FoxNews,Fri May 03 11:37:24 +0000 2024,Anti-Israel college protests spread to Australia as encampments pop up https://t.co/4V3XEy61fr
1786361636908892238,FoxNews,Fri May 03 11:46:17 +0000 2024,Ex-49ers star discusses state of team after another crushing Super Bowl: \They have everything they need\ https://t.co/q4dJ5rYMai
1786362516219539779,FoxNews,Fri May 03 11:49:47 +0000 2024,FOX NEWS FIRST: Biden ripped for Islamophobia remarks amid antisemitism outbreak and more top headlines\nhttps://t.co/ibsSpcbdfw
1786364341933035913,FoxNews,Fri May 03 11:57:02 +0000 2024,Lakers \real\ candidates for next head coach both have strong connection to LeBron James: report https://t.co/lJGdymazNT
1786365136845816124,FoxNews,Fri May 03 12:00:12 +0000 2024,LIBRARY LOOTED: Video shows graffiti, ripped-out fire extinguishers and broken ceiling tiles inside the Portland State University library. Anti-Israel agitators decimated school property before police were able to clear out the unruly mobs. https://t.co/iaZSaXesvZ
1786365271252271140,FoxNews,Fri May 03 12:00:44 +0000 2024,Where\s Michael Cohen now? Who went there with Melissa McCarthy? https://t.co/kNv1azCylo
1786367654967542008,FoxNews,Fri May 03 12:10:12 +0000 2024,UCLA student slams university for \encouraging violence,\ turning campus into \war zone\: \This is a disgrace\ https://t.co/PdGdG3GBmm
1786368863354954097,CBSNews,Fri May 03 12:15:00 +0000 2024,A forensic analyst who works for Manhattan District Attorney Alvin Bragg will resume testimony Friday in the trial of former President Donald Trump.  https://t.co/OlySElduDl
1786369477799526747,FoxNews,Fri May 03 12:17:27 +0000 2024,Opinion | When private property is taken by squatters, all of society pays a price https://t.co/yYcThvHxfm
1786371673815445834,FoxNews,Fri May 03 12:26:10 +0000 2024,Catholics\ support swings for Trump over Biden by significant margin: poll https://t.co/qnWwL5HiI8
1786372687041863762,FoxNews,Fri May 03 12:30:12 +0000 2024,\DANGEROUS\: Jewish students who snapped \disturbing\ photo of man with Hamas headband on campus speak out. https://t.co/6aR3XcMoS4 https://t.co/RgbiJCvoLt
1786373939809202583,CBSNews,Fri May 03 12:35:11 +0000 2024,A lawsuit says if emergency responders had known about widespread cellphone outages during last year\s deadly Maui wildfires, they would\ve used other methods to warn about the disaster. https://t.co/5ML9kdNxT4
1786374931409694784,FoxNews,Fri May 03 12:39:07 +0000 2024,House-passed antisemitism bill may violate First Amendment warn critics: \Misguided and harmful\ https://t.co/p4uTg9vjfX
1786376888216158561,CBSNews,Fri May 03 12:46:54 +0000 2024,Russian military personnel have entered an airbase in Niger where some U.S. troops are located, two U.S. officials confirmed to CBS News on Thursday https://t.co/XxhEthNCJj
1786376905928716712,FoxNews,Fri May 03 12:46:58 +0000 2024,7 things you need to pack on your European summer tour https://t.co/KpjxAMkfx7
1786378793931682209,FoxNews,Fri May 03 12:54:28 +0000 2024,Bernie Sanders warns Biden\s support for Israel may sink his presidency and become his \Vietnam\ https://t.co/8eEHr9ATHN
1786380188227395852,CBSNews,Fri May 03 13:00:00 +0000 2024,Hiring across the U.S. fell in April, a sign the Federal Reserve\s efforts to shackle economic growth and curb inflation is chilling the labor market. https://t.co/kM4FgsdbCv
1786380335594213696,FoxNews,Fri May 03 13:00:36 +0000 2024,\TERRIFIES ME\: Restaurant owner says crime worse than ever due to city\s out-of-control homeless crisis. https://t.co/k4xhGAWMbj https://t.co/Nklm5Sit1k
1786381429334544591,FoxNews,Fri May 03 13:04:56 +0000 2024,BREAKING: US economy adds 175K jobs in April, much weaker than expected https://t.co/LroRhgOkjH
1786383243043852609,CBSNews,Fri May 03 13:12:09 +0000 2024,RT @CBSMornings: Some residents in southeastern Texas are facing mandatory evacuations, as flooding reaching several feet is now life-threa…
1786383256838975918,CBSNews,Fri May 03 13:12:12 +0000 2024,RT @CBSMornings: Hundreds of people were arrested on college campuses Thursday, in the latest fallout from protests against the war in Gaza…
1786383266808815843,CBSNews,Fri May 03 13:12:14 +0000 2024,RT @CBSMornings: President Biden appealed for calm as even more campus protests against the war in Gaza are cleared by law enforcement.\n\nWh…
1786383280075309461,CBSNews,Fri May 03 13:12:18 +0000 2024,RT @CBSMornings: A section of I-95, one of America’s busiest highways, is shut down for at least several days, after a fiery crash Thursday…
1786383289281884177,CBSNews,Fri May 03 13:12:20 +0000 2024,RT @CBSMornings: A former attorney for adult film actor Stormy Daniels testified Thursday in former Pres. Trump’s criminal trial in New Yor…
1786383307451535684,CBSNews,Fri May 03 13:12:24 +0000 2024,RT @CBSMornings: For the first time ever, America’s top teachers were invited to a state dinner at the White House to honor their work.\n\nIt…
1786383500943229043,FoxNews,Fri May 03 13:13:10 +0000 2024,Britney Spears, Sam Asghari finalize divorce after 1 year of marriage https://t.co/uqm4SbKcQp
1786385220188410238,CBSNews,Fri May 03 13:20:00 +0000 2024,The Smashing Pumpkins has been an iconic alt-rock ban for decades. And now the group has added a new member to help them carry on for decades more.  https://t.co/3iadJHHc2T
1786385386446438626,FoxNews,Fri May 03 13:20:40 +0000 2024,Politico co-founder urges media to \be more humble\ as trust in journalism plummets https://t.co/dBlsns3Qr5
1786387288361984075,FoxNews,Fri May 03 13:28:13 +0000 2024,3-time Kentucky Derby horse owner says \humble beginning\ catapulted her to \sport of kings\: \American Dream\ https://t.co/Gq7o0hr0Lm
1786389293012840617,FoxNews,Fri May 03 13:36:11 +0000 2024,Lee Greenwood on America\s veterans and pride in our country: \I have great faith\ https://t.co/ohZWMYzdd4
1786390251763618073,CBSNews,Fri May 03 13:40:00 +0000 2024,Russia\s government blasted France\s President Emmanuel Macron for again suggesting his country would consider sending troops to Ukraine to help defend against Russia\s ongoing invasion, if Kyiv were to request that level of help.  https://t.co/4bXyfEZ9W3
1786391261613609423,FoxNews,Fri May 03 13:44:00 +0000 2024,Valerie Bertinelli admits Eddie Van Halen was \not a soulmate,\ marriage declined into drugs, infidelity https://t.co/n0atUFFrni
1786393146525356241,FoxNews,Fri May 03 13:51:30 +0000 2024,Priscilla Presley\s son details how mom helped him through horrific drug addiction https://t.co/VzLNTlUQn7
1786395318046630296,FoxNews,Fri May 03 14:00:08 +0000 2024,MAYDAY! Watch a small plane make an emergency landing on a Long Island, NY beach, miraculously the pilot and passenger walked away unhurt. https://t.co/8C1UTGF6ml
1786395591053807995,CBSNews,Fri May 03 14:01:13 +0000 2024,RT @CBSMornings: .@realmarcsummers has enjoyed a long career in front of and behind the camera, hosting shows like @nickelodeon’s “Double D…
1786395599081722064,CBSNews,Fri May 03 14:01:15 +0000 2024,RT @CBSMornings: As protests have erupted on college campuses, some say chants are slogans of resistance — while others say they incite vio…
1786395627489743081,CBSNews,Fri May 03 14:01:21 +0000 2024,RT @CBSMornings: For the first time, Boeing plans to launch astronauts to the International Space Station on its spaceship, Starliner. The…
1786395638902542483,CBSNews,Fri May 03 14:01:24 +0000 2024,RT @CBSMornings: Pres. Biden will present the Presidential Medal of Freedom to 19 Americans, including former Speaker of the House Nancy Pe…
1786397397905440932,FoxNews,Fri May 03 14:08:23 +0000 2024,Mexican beer the most popular in US: Cinco de Mayo will fiesta to the flavor of these cinco cervezas https://t.co/RY2jAdckOx
1786399062071099611,CBSNews,Fri May 03 14:15:00 +0000 2024,Job site Indeed identified the top 10 most sought-after job candidates by employers and recruiters. Here\s what they found.  https://t.co/S2vrX0S7BT
1786399407308468299,FoxNews,Fri May 03 14:16:23 +0000 2024,These illegal immigrants are eligible for Obamacare after Biden rule change https://t.co/F2FNAUsFjg
1786401731003174925,FoxNews,Fri May 03 14:25:37 +0000 2024,Bucks\ Patrick Beverley hurls basketball at fans behind the bench during Game 6 loss to Pacers https://t.co/BtEmssvP8E
1786402837066285371,CBSNews,Fri May 03 14:30:00 +0000 2024,Former U.K. Prime Minister Boris Johnson was turned away from his local polling station Thursday as he failed bring with him photo identification, which is required under a relatively new law introduced by his government two years ago.  https://t.co/gI44kxosrC
1786403970841231374,FoxNews,Fri May 03 14:34:31 +0000 2024,Fox News ‘Antisemitism Exposed’ Newsletter: Columbia calls NYPD, fraternity goes viral for defending US flag https://t.co/xvuYjYnntm
1786405692158410934,CBSNews,Fri May 03 14:41:21 +0000 2024,RT @camiloreports: As we reported live from El Paso, Texas for @CBSNews, we witnessed 3 migrants who appeared to be unaccompanied children…
1786406080349696448,FoxNews,Fri May 03 14:42:54 +0000 2024,California woman who avoided prison after stabbing boyfriend 108 times while high appealing light sentence https://t.co/FHfdBdF4IV
1786406612434817335,CBSNews,Fri May 03 14:45:00 +0000 2024,Scientists have been warning for years that bumblebee populations are declining. New research has found a \major factor\ in why.  https://t.co/urBOPPrOia
1786408208250118382,FoxNews,Fri May 03 14:51:21 +0000 2024,Ryan Gosling has his \family in mind first\ when choosing movie roles https://t.co/WfL6GjjWXO
1786410401531396115,CBSNews,Fri May 03 15:00:04 +0000 2024,Mexican authorities said Thursday they have found tents and questioned three people in the case of two Australians and an American who went missing over the weekend in Baja California.  https://t.co/1hTlIsWBxe
1786410686056169589,FoxNews,Fri May 03 15:01:12 +0000 2024,Kate Beckinsale says \it\s been a rough year\ in first appearance since undisclosed medical issue https://t.co/yrDn3P0Nns
1786411106598068427,FoxNews,Fri May 03 15:02:52 +0000 2024,PROUD AMERICAN: College student pelted with rocks after standing up for US flag says she would die for Old Glory. https://t.co/zmuwftzifY https://t.co/ffaGVVogB5
1786413061999296540,FoxNews,Fri May 03 15:10:38 +0000 2024,Small aircraft plows into sand during emergency landing on Long Island beach https://t.co/wW5DeLqtEc
1786414925511881062,FoxNews,Fri May 03 15:18:02 +0000 2024,\Death to Israel,\ \Death to America\ signs found on NYU property, NYPD says https://t.co/zZfkQ3E2Ha
1786415420527825133,CBSNews,Fri May 03 15:20:00 +0000 2024,A New York City man has pleaded guilty to attempting to sell prohibited wild animal parts, including a cougar head. https://t.co/pUdSSonV6j
1786416601455067275,FoxNews,Fri May 03 15:24:42 +0000 2024,Celebrate the mother figure in your life this Mother’s Day with a \Love, Mom\ gift bundle. The bundle includes a \Love, Mom\ by @NBSaphierMD eBook and a box of Cheryl’s Cookies. Order today and get 20% off by using promo code 20OFF. https://t.co/RW75cYcTxR https://t.co/4rKy30af3T
