id_str,posted_by,created_at,full_text
1787427782462415313,FoxNews,Mon May 06 10:22:46 +0000 2024,RT @FoxNewsAI: US Air Force Secretary Kendall flies in cockpit of plane controlled by AI https://t.co/zMdYAnrFqs
1787428319928910293,FoxNews,Mon May 06 10:24:54 +0000 2024,Biden needs to ‘practice what he preaches’ and rise to the moment after lecturing press, critics say https://t.co/k8RUDNVA91
1787429603570520152,CBSNews,Mon May 06 10:30:00 +0000 2024,A church service in North Braddock, Pennsylvania was upended Sunday when a man pulled a gun on the pastor in the middle of his sermon.  https://t.co/fgm4cgCQwh
1787430492062531681,FoxNews,Mon May 06 10:33:32 +0000 2024,Biden campaign touts keeping president\s speeches shorter: \Quality over quantity\ https://t.co/FRwCjgly3Y
1787432774988648700,FoxNews,Mon May 06 10:42:37 +0000 2024,Trump\s legal team returns to court after Bragg\s own witness implodes case and more top headlines https://t.co/6z3WRgxjoo
1787434913102237698,FoxNews,Mon May 06 10:51:06 +0000 2024,New York City booting migrants from long-time shelters to prepare for ‘summer surge’ of illegal immigration https://t.co/HO43QQ4gzz
1787434964134371711,FoxNews,Mon May 06 10:51:19 +0000 2024,FOX NEWS FIRST: Trump\s legal team returns to court after Bragg\s own witness implodes case and more top headlines\nhttps://t.co/XxkYFLjPUQ
1787437025374654835,FoxNews,Mon May 06 10:59:30 +0000 2024,Israel urges Palestinians to evacuate Rafah ahead of expected ground operation in Hamas stronghold https://t.co/LxMme1Avik
1787437151665230073,CBSNews,Mon May 06 11:00:00 +0000 2024,Tom Brady got roasted by comedians, former teammates and his longtime coach Sunday night during a made-for-streaming comedy live event on Netflix. \n\n\This is what a locker room has been like for me for all these years,\ Brady said before the event. https://t.co/CNngWz2zdM
1787437154580550145,FoxNews,Mon May 06 11:00:01 +0000 2024,HERO\S HOWL: Beloved K9 Dzino bewilders officers with a hilariously accurate imitation of a police siren. https://t.co/buSZlkEiq4
1787439133771571403,FoxNews,Mon May 06 11:07:53 +0000 2024,George Clooney: From hit TV shows to big time blockbusters like \Batman,\ \Ocean\s Eleven\ and more https://t.co/DwSoqgSpM7
1787440927960629690,CBSNews,Mon May 06 11:15:00 +0000 2024,Israel’s military ordered Palestinians in the eastern part of the Gaza Strip city of Rafah to evacuate Monday ahead of a ground offensive that’s expected to come despite last-ditch efforts led by the U.S., Qatar and Egypt to broker a new cease-fire deal. https://t.co/V9UFsbMoRT
1787441264780025917,FoxNews,Mon May 06 11:16:21 +0000 2024,Noem addresses feeling \threatened\ by Nikki Haley, a controversial dog killing, Trump VP speculation in book https://t.co/xhfuKGqiTy
1787443309541048764,FoxNews,Mon May 06 11:24:28 +0000 2024,Bill Belichick rips Tom Brady, former Patriots players in hilarious appearance at Netflix roast https://t.co/erXmRlv2nM
1787444702117040233,CBSNews,Mon May 06 11:30:00 +0000 2024,The fourth week of Donald Trump\s criminal trial in New York begins Monday as prosecutors look to build on emotional testimony from an ex-aide to the former president.  https://t.co/bgvWeMiFs4
1787445295531401646,FoxNews,Mon May 06 11:32:22 +0000 2024,Patriots owner Robert Kraft calls out Vladimir Putin at Tom Brady roast: ‘Give me my f---ing ring back’ https://t.co/d9si1SaEOi
1787447316389015636,FoxNews,Mon May 06 11:40:24 +0000 2024,Gang-related shooting in Long Beach, California leaves at least 7 wounded, police say https://t.co/hCHn71OwJi
1787449362676670794,FoxNews,Mon May 06 11:48:31 +0000 2024,Israel blocks Al Jazeera, moves to close down offices in country: \Hamas\ mouthpiece\ https://t.co/xWXqWteRVf
1787451409564082301,FoxNews,Mon May 06 11:56:39 +0000 2024,Kyle Larson wins at Kansas in closest NASCAR Cup Series finish in history https://t.co/C7qYrWeM3j
1787452249620271491,CBSNews,Mon May 06 12:00:00 +0000 2024,A person fell from the stands to their death Sunday during the graduation ceremony for Ohio State University.  https://t.co/qPjqIBuGq5
1787452383322046685,FoxNews,Mon May 06 12:00:32 +0000 2024,FAILING GRADE: GOP senator @marcorubio blasts Biden as violent anti-Israel mobs rage unhinged on university campuses nationwide. https://t.co/Oi6Swkqna7
1787454298399412642,FoxNews,Mon May 06 12:08:08 +0000 2024,Caitlin Clark at center of another awkward question before WNBA preseason debut https://t.co/MNnVSn4KCH
1787455117857280446,FoxNews,Mon May 06 12:11:24 +0000 2024,RT @FoxNewsAI: Opinion | Biden\s radical trade commission wages war on American AI https://t.co/OKZY8z96is
1787456126516154652,FoxNews,Mon May 06 12:15:24 +0000 2024,Teens rescued from abandoned Colorado missile silo; 1 injured, another facing charges https://t.co/9PQeBgmT51
1787458273152516252,FoxNews,Mon May 06 12:23:56 +0000 2024,Opinion | Biden’s student loan bailout is to buy good will with your hard-earned cash https://t.co/epJXIbwG29
1787459801946931357,CBSNews,Mon May 06 12:30:00 +0000 2024,How much does a Met Gala ticket cost? Here\s a look at the price of entry for fashion\s biggest night. https://t.co/SOaXAFb37h
1787460357331546383,FoxNews,Mon May 06 12:32:13 +0000 2024,House Dems seeking re-election seemingly reverse course, call on Biden to \bring order to the southern border\ https://t.co/qBjpIMhIbw
1787462177311330393,FoxNews,Mon May 06 12:39:27 +0000 2024,New York hotel in iconic Broadway theater district quietly converted into migrant shelter: Report https://t.co/0fCKT5gF2w
1787464083823890898,FoxNews,Mon May 06 12:47:01 +0000 2024,NY v. Trump to resume Monday after eventful third week of testimony, thousands of dollars of gag order fines https://t.co/GGmVF7mss5
1787465861734744385,FoxNews,Mon May 06 12:54:05 +0000 2024,American Culture Quiz: From country music to major hit songs, how vast is your knowledge? https://t.co/bD1aGZ2zGm
1787465919351959614,CBSNews,Mon May 06 12:54:19 +0000 2024,RT @CBSMornings: Hundreds of people had to be rescued across southeast Texas over the weekend, after nearly two feet of torrential rain fel…
1787465932614320136,CBSNews,Mon May 06 12:54:22 +0000 2024,RT @CBSMornings: As parts of Texas deal with dangerous flooding, the state could see a tornado outbreak today, winds over 70 mph and baseba…
1787465940247925045,CBSNews,Mon May 06 12:54:24 +0000 2024,RT @CBSMornings: Police cleared an encampment at the University of Southern California over the weekend, where people protesting against th…
1787465951211868604,CBSNews,Mon May 06 12:54:26 +0000 2024,RT @CBSMornings: After years of delays, Boeing is ready to launch its new Starliner spaceship with a crew for the first time.\n\nThe aerospac…
1787465959655022626,CBSNews,Mon May 06 12:54:28 +0000 2024,RT @CBSMornings: Israel has issued a warning to many of the more than 1 million Palestinians sheltering in Rafah in Gaza’s south to get out…
1787467349404041492,CBSNews,Mon May 06 13:00:00 +0000 2024,Police are searching for an abducted 10-month-old girl whose mother was one of two women found dead at a park near Clovis, New Mexico. Authorities said a 5-year-old girl was also found critically injured. https://t.co/muIIIeh7rb
1787467349840290119,FoxNews,Mon May 06 13:00:00 +0000 2024,STRANGE SIGHTING: Americans are left bewildered as a mysterious light, shrouded in fog, illuminates the night sky above Arizona, prompting speculation of a possible UFO sighting. https://t.co/5gdnplBOCm
1787467794096750592,CBSNews,Mon May 06 13:01:46 +0000 2024,Brazil floods death toll nears 90 as rescue efforts continue amid skyscrapers of Porto Alegre.  https://t.co/kq0FyaX7ia
1787467823364608073,FoxNews,Mon May 06 13:01:53 +0000 2024,Nathan Wade speaks out on \workplace romance\ with Fulton County DA Fani Willis: \American as apple pie\ https://t.co/MCexwBA1Ws
1787469852967321782,FoxNews,Mon May 06 13:09:57 +0000 2024,7 classic summer perfume scents and their dupes perfect for Mother\s Day https://t.co/qefFZ9vIHz
1787471244805165402,FoxNews,Mon May 06 13:15:29 +0000 2024,HATE WINS: University-wide commencement ceremonies at the Ivy League institution will no longer be taking place in the wake of anti-Israel agitators spurring violent riots across the campus. Follow developing details on this story. https://t.co/YYVQ8J75Dz https://t.co/A1Zk2bgQEI
1787472385014153450,CBSNews,Mon May 06 13:20:00 +0000 2024,Steward Health Care, the struggling hospital group that owns nine hospitals in Massachusetts, announced Monday that it is filing for bankruptcy.  https://t.co/LDO1HwAZn7
1787473024884650080,FoxNews,Mon May 06 13:22:33 +0000 2024,Vulnerable Dem. Sen ripped after raking in cash from corporate PACs despite previous objections: \Hypocrisy\ https://t.co/ro0Kr6zLqJ
1787474974711689438,FoxNews,Mon May 06 13:30:18 +0000 2024,Tennis stars Stefanos Tsitsipas, Paula Badosa call it quits after about a year https://t.co/lsBbxrK1CM
1787476093697442107,CBSNews,Mon May 06 13:34:45 +0000 2024,RT @CBSMornings: Three surfers, an American and two Australian brothers, were found dead in Baja California, Mexico on Friday.\n\nThree suspe…
1787476105437266256,CBSNews,Mon May 06 13:34:47 +0000 2024,RT @CBSMornings: Former Trump aide Hope Hicks had emotional testimony as a witness at the former president’s criminal trial.\n\nFor prosecuto…
1787476156960137563,CBSNews,Mon May 06 13:35:00 +0000 2024,The fourth week of Donald Trump\s criminal trial in New York begins today as prosecutors look to build on emotional testimony from an ex-aide to the former president.  https://t.co/x6hS3Z2ayW
1787476811993022578,FoxNews,Mon May 06 13:37:36 +0000 2024,Israel has \no choice\ on Rafah invasion as long as Hamas is holding hostages, says former PM Bennett https://t.co/FQaEGfWeMP
1787477465801031757,CBSNews,Mon May 06 13:40:12 +0000 2024,Dashcam video captured a powerful tornado with 158 mph winds ripping apart a building in Lincoln, Nebraska last month during a deadly, multi-state outbreak of severe storms. https://t.co/CNrQehaS3H
1787478676574970274,CBSNews,Mon May 06 13:45:00 +0000 2024,Columbia University said it is canceling its main commencement ceremony after weeks of protests and turmoil on campus.   https://t.co/ebKxEinC42
1787478972537716977,FoxNews,Mon May 06 13:46:11 +0000 2024,These 5 NYC tourist sites prove lasting popularity of \Friends\ TV sitcom https://t.co/Fu5ZZltM4h
1787479544779202602,CBSNews,Mon May 06 13:48:27 +0000 2024,Judge Juan Merchan imposed another $1,000 fine for another violation of Donald Trump\s gag order, which limits what Trump can say about witnesses and others involved in the case. Merchan said he could impose stiffer penalties in the future. https://t.co/IwRKveBfZl
1787481056767037794,FoxNews,Mon May 06 13:54:28 +0000 2024,Biden’s Title IX change blasted by parents’ rights group as redefining sex: ‘A grave threat’ https://t.co/QhNpl1w96h
1787482580759040432,FoxNews,Mon May 06 14:00:31 +0000 2024,\GLORY TO GOD\: Former Latin Kings gang member, now a Christian minister, details his come-to-Jesus moment after serving a lengthy prison sentence and surviving a near-fatal overdose. The life-changing story. https://t.co/NYTIOGCSQg https://t.co/QoLI07INAr
1787484523086725258,FoxNews,Mon May 06 14:08:14 +0000 2024,How to recover a hacked Facebook account https://t.co/oEZUQqayst
1787486726618808547,FoxNews,Mon May 06 14:17:00 +0000 2024,Democrats worry Biden doesn’t have enough ‘energy,\ support behind him to beat Trump in a rematch: Report https://t.co/Q7GwwXzwLp
1787487182178943142,CBSNews,Mon May 06 14:18:48 +0000 2024,Decades ago, peregrine falcons were largely absent from California and much of the U.S. amid widespread use of pesticides. But now, a pair of the fastest birds in the world are nesting on Alcatraz Island. https://t.co/13wO9xHsqH
1787488940619915754,FoxNews,Mon May 06 14:25:48 +0000 2024,NY v Trump: Judge threatens jail time for \possibly the next president\ for future gag order violations https://t.co/jUf1IWeT64
1787489845838848225,FoxNews,Mon May 06 14:29:23 +0000 2024,Maher torches Biden\s student loan handout: \My tax dollars are supporting this Jew hating? I don\t think so!\ https://t.co/mRcLRNtAKB
1787492013048230293,FoxNews,Mon May 06 14:38:00 +0000 2024,PROUD AMERICANS: Patriotic students drown out anti-Israel mob with loud chants of \USA\ at Rutgers University. https://t.co/3cgfv8VzUb https://t.co/zhf2zxEOJ6
1787492530663104637,CBSNews,Mon May 06 14:40:03 +0000 2024,RT @CBSMornings: The season 6 finale of @TheNeighborhood airs tonight on @CBS and @paramountplus— and @CedEntertainer reveals the episode’s…
1787492541270487368,CBSNews,Mon May 06 14:40:06 +0000 2024,RT @CBSMornings: Tom Selleck writes about his six decades in Hollywood, including why it took him a year to accept a starring role in “Magn…
1787492551345197226,CBSNews,Mon May 06 14:40:08 +0000 2024,RT @CBSMornings: This Arkansas barista was finally able to buy an urn for her mom’s remains — thanks to a gift from a stranger: “The $200 y…
1787492642944631156,CBSNews,Mon May 06 14:40:30 +0000 2024,RT @CBSMornings: Some excerpts from @GovKristiNoem’s book, “No Going Back,” have drawn criticism, including one in which she describes shoo…
1787492650553127420,CBSNews,Mon May 06 14:40:32 +0000 2024,RT @CBSMornings: “I’m firstly fighting for trying to get back to winning a championship”: @LewisHamilton says he’s ready for a comeback wit…
1787493958932648105,CBSNews,Mon May 06 14:45:44 +0000 2024,Here\s what happens inside the Met Gala after the red carpet   https://t.co/569DSPDbw2
1787494183193677911,FoxNews,Mon May 06 14:46:37 +0000 2024,Utah police officer killed by semi-truck, suspect arrested after hours-long manhunt https://t.co/CaXCNDDjfO
1787495344021831855,CBSNews,Mon May 06 14:51:14 +0000 2024,RT @DavidBegnaud: Here’s the debut of ‘Dear David’. It’s a new segment we created based on story ideas sent by viewers, like you. Enjoy our…
1787495926073819350,FoxNews,Mon May 06 14:53:33 +0000 2024,Texas dad reveals chilling text he received moments before wife shot 3-year-old son https://t.co/OwlDmzS1ea
1787497561625882928,FoxNews,Mon May 06 15:00:03 +0000 2024,\DISASTER\: Wild video shows US sailing team flying overboard as boat capsizes. What triggered the sudden turbulence. https://t.co/k4CiBBgsgs https://t.co/WBVZVYcq0F
1787498540408754451,FoxNews,Mon May 06 15:03:56 +0000 2024,Ex-top Biden DOJ official now prosecuting Trump was once paid by DNC for \political consulting\ https://t.co/w3YCnSx3ng
1787498816616247599,CBSNews,Mon May 06 15:05:02 +0000 2024,The 2024 Met Gala theme is \The Garden of Time\ — to go along with the spring exhibition, titled \Sleeping Beauties: Reawakening Fashion.\ These are the past themes leading up to today\s gala.\nhttps://t.co/hHq5CncwWh https://t.co/CjmPs2wSrS
1787500001318387917,CBSNews,Mon May 06 15:09:45 +0000 2024,A newborn giraffe named Tino gallops just days after being born at the Houston Zoo. Zookeepers knew his mom was pregnant, but didn\t know her due date – until she gave birth to 160-pound 6-foot-tall Tino ❤️ https://t.co/8mavjxXXNx
1787500388603633964,FoxNews,Mon May 06 15:11:17 +0000 2024,Pennsylvania man aims gun at pastor in church, interrupts sermon on video https://t.co/uqBJp8zH00
1787502157886894214,FoxNews,Mon May 06 15:18:19 +0000 2024,Rolling Stones\ Mick Jagger claims Louisiana governor \trying to take us back to the Stone Age\ https://t.co/zpcqMj09EF
1787503839936966933,CBSNews,Mon May 06 15:25:00 +0000 2024,Russia said it plans to hold drills simulating the use of battlefield nuclear weapons, amid rising tension following comments by senior Western officials about the possibility of deeper involvement in the war in Ukraine.  https://t.co/Pgm5Vh2NbA
1787504555103526915,FoxNews,Mon May 06 15:27:50 +0000 2024,RT @FoxNewsAI: US will fall behind in AI race without onshoring chip production: \Can\t just design,\ expert says https://t.co/FGdNs4ymcc
1787505956135350651,FoxNews,Mon May 06 15:33:24 +0000 2024,Ex-top Biden DOJ official now prosecuting Trump was once paid by DNC for \political consulting\ https://t.co/jYA4VAFmu0
1787506547758690600,CBSNews,Mon May 06 15:35:45 +0000 2024,Sen. Bernie Sanders says he will seek reelection in November. \n https://t.co/DEgYf3Pd22
1787507617482301934,CBSNews,Mon May 06 15:40:00 +0000 2024,South Dakota Gov. Kristi Noem, facing criticism for a story in her new book about killing her dog, suggested that President Biden should do the same with his former dog, Commander. \n https://t.co/Dl0nRB6xqW
1787508295030227419,FoxNews,Mon May 06 15:42:42 +0000 2024,UN agency accused of being part of Hamas after Israel strikes terrorist HQ https://t.co/I2DQQH9FeZ
1787510132714197111,CBSNews,Mon May 06 15:50:00 +0000 2024,Hormel Foods is recalling two Planters products — peanuts and mixed nuts — shipped to Dollar Tree and Publix warehouses in five states because they may be tainted with listeria.  https://t.co/j6Wo3xmvqG
1787510310326108327,FoxNews,Mon May 06 15:50:42 +0000 2024,New Jersey State Police trooper dies at headquarters during training for elite unit https://t.co/JPeB1lxAmE
1787512659673223380,CBSNews,Mon May 06 16:00:03 +0000 2024,The Condé Nast union said it has reached a tentative labor agreement with the publisher\s management just hours ahead of the Met Gala.\n https://t.co/OMbBKIssz3
1787512727688163749,FoxNews,Mon May 06 16:00:19 +0000 2024,\RIDICULOUS\: Trump unleashes against \deeply conflicted\ judge as former president\s criminal trial enters its third week. https://t.co/YryxUpegyk https://t.co/l4HrqnEio4
1787513908401516735,CBSNews,Mon May 06 16:05:00 +0000 2024,Man sitting on side of Oklahoma interstate confesses to woman\s cold case murder, police say https://t.co/QYmCp1evsQ
1787514686973391307,FoxNews,Mon May 06 16:08:06 +0000 2024,\The Fall Guy\ star Emily Blunt admits kissing certain costars made her want to throw up https://t.co/hrloddskXL
1787516424396628119,CBSNews,Mon May 06 16:15:00 +0000 2024,The judge overseeing Donald Trump\s criminal trial in New York held him in contempt of court for violating a gag order for the 10th time, warning that future infractions could bring jail time.  https://t.co/Db55RQmEwy
1787516895639327056,FoxNews,Mon May 06 16:16:53 +0000 2024,PROUD AMERICANS: Anti-Israel agitators silenced as Ole Miss students gather to sing the Star Spangled Banner. https://t.co/gdbdyH7lTj
1787518451784864132,CBSNews,Mon May 06 16:23:04 +0000 2024,RT @CBSEveningNews: Here\s a look at what\s coming up on the CBS Evening News with @NorahODonnell at 6:30 p.m. ET. https://t.co/ttWYKegwpt
1787518513881534498,CBSNews,Mon May 06 16:23:18 +0000 2024,RT @CBSNewsPress: Just Announced: CBS News And Stations Welcomes Lindsey Reiser as Anchor and Correspondent for CBS News 24/7. More here: h…
1787518725547086238,CBSNews,Mon May 06 16:24:09 +0000 2024,RT @LindseyReiser: I\m thrilled to be joining the @CBSNews team and can\t wait to get started! Stream CBS News 24/7 on the home page or the…
1787519056465088781,FoxNews,Mon May 06 16:25:28 +0000 2024,Person at Ohio State graduation ceremony falls to death from stands https://t.co/CLVNeshRdk
1787520200176263563,CBSNews,Mon May 06 16:30:00 +0000 2024,Kendrick Lamar and Drake have each released several ruthless diss tracks against each other over the past week, taking jabs at height and style and making allegations about each others\ children and other disturbing accusations.  https://t.co/eLCUnrnXFW
1787520860976189814,FoxNews,Mon May 06 16:32:38 +0000 2024,Ex-NBA guard Darius Morris dead at 33 https://t.co/cJaCuQg5JR
1787522629852652012,FoxNews,Mon May 06 16:39:40 +0000 2024,ABC host issues warning on \most important election of our time\: \No more crying wolf\ https://t.co/qwNyRoohhW
1787524002677772573,CBSNews,Mon May 06 16:45:07 +0000 2024,Zakia Wardak, Afghanistan\s top diplomat in India, announced her resignation after reportedly being stopped at an airport with the gold cache.\n https://t.co/F2aDUzXDtJ
1787524398959804618,FoxNews,Mon May 06 16:46:41 +0000 2024,Tom Brady takes Deflategate swipe at Netflix roast special: \Where\s Roger Goodell?\ https://t.co/Tqmm3bGivP
1787526470111293952,FoxNews,Mon May 06 16:54:55 +0000 2024,Abducted 10-month-old New Mexico girl found alive after mother fatally shot, suspect in custody https://t.co/ZEaQG5vW2S
1787527752868057233,FoxNews,Mon May 06 17:00:01 +0000 2024,\POSSESSED\: Shocking church video shows gunman rush pastor during Sunday sermon. The \miracle\ that stopped the shooting. https://t.co/Set4FwkX9p https://t.co/h7QuuRVTKA
1787527755006963796,CBSNews,Mon May 06 17:00:02 +0000 2024,A bear is believed to have dragged the body of a western Massachusetts crash victim out of his car, state police say.  https://t.co/UI5PDqWEbR
1787529066876166468,FoxNews,Mon May 06 17:05:14 +0000 2024,\8 SIMPLE RULES\: The star actress opens up about how she \wanted something away from\ the glitz and glamour of the red carpet lifestyle. https://t.co/UUYbk1X0fH https://t.co/OOf4sogE3G
1787531114141061256,FoxNews,Mon May 06 17:13:22 +0000 2024,Ben Affleck\s \unhinged\ Tom Brady roast gets actor slammed online https://t.co/q7sCyvuQTh
1787532942018834771,FoxNews,Mon May 06 17:20:38 +0000 2024,\ENCOURAGING, INSPIRING\: Riley Gaines shares her message to college graduates as commencement speaker, as school\s president vows to \not cave in\ to student backlash in her defense. https://t.co/571J3cCF12 https://t.co/DArnTYnnDN
1787535215167959298,FoxNews,Mon May 06 17:29:40 +0000 2024,Chicago Teachers Union under fire for $50B demands as academics plummet: \Most radical agenda yet\ https://t.co/O6oJyaUAMZ
1787535296675918182,CBSNews,Mon May 06 17:30:00 +0000 2024,South Dakota Gov. Kristi Noem on Monday defended controversial passages in her forthcoming book as she faces scrutiny over a number of anecdotes, including a false claim about a meeting with Kim Jong Un.  https://t.co/GybQCkomNc
1787537338773434709,FoxNews,Mon May 06 17:38:07 +0000 2024,Presidential polls show deadlocked race as party conventions quickly approach https://t.co/40Ol3zQm4B
1787539072308724007,CBSNews,Mon May 06 17:45:00 +0000 2024,An Atlas 5 rocket carrying astronauts was primed for blastoff Monday night to boost Boeing\s long-delayed Starliner crew ferry ship into orbit for its first piloted test flight to the International Space Station. \n https://t.co/kTQXWy3xl7
1787539569128161307,FoxNews,Mon May 06 17:46:58 +0000 2024,New York college student, 19, in coma after illegal dirt bike hit-and-run https://t.co/b8sYcFF7v9
1787541799097032958,FoxNews,Mon May 06 17:55:50 +0000 2024,Emma Watson, Lily James, other stars who played princesses ahead of the \Sleeping Beauties\ themed Met Gala https://t.co/FqBA93ExSQ
1787542887460200655,FoxNews,Mon May 06 18:00:09 +0000 2024,\DIRECT ATTACK\: Judge in New York criminal trial acknowledges Trump is poised to be the next president but warns jail time is still on the table after repeated gag order violations. The judge\s stark message to the White House contender. https://t.co/aYFF3C2Juo https://t.co/k7ZRQYCAlL
1787544905729896930,FoxNews,Mon May 06 18:08:11 +0000 2024,Squatters return to Georgia House candidate\s home after arrest: \Worst criminal activity I\ve ever seen\ https://t.co/gwiJ2f9q8p
1787546527700803751,CBSNews,Mon May 06 18:14:37 +0000 2024,A Starbucks barista in Little Rock, Arkansas, had a memorable shift last month thanks to her cheerful demeanor and the kindness of a customer. https://t.co/JqZSpOVXiZ
1787547163121131905,FoxNews,Mon May 06 18:17:09 +0000 2024,Jen Psaki urges Biden to join \The View,\ defends him dodging journalists https://t.co/J7ZlvckrzY
1787549305781235714,FoxNews,Mon May 06 18:25:40 +0000 2024,Rumble reveals censorship demands from surprising list of countries as CEO to testify on free speech threats https://t.co/UPlgWygRPn
1787551523762790691,FoxNews,Mon May 06 18:34:29 +0000 2024,UFC\s Dana White flames Netflix for only getting 60 seconds to roast Tom Brady https://t.co/brz2jMq7ny
1787551655036174554,CBSNews,Mon May 06 18:35:00 +0000 2024,Skin cancer is one of the most preventable types of cancer, yet it remains one of the most common — and a recent survey finds not enough people are taking the right precautions, raising their risk.  https://t.co/Y81xmotz8m
1787553716343558265,FoxNews,Mon May 06 18:43:11 +0000 2024,Tom Selleck risks losing California ranch with cancelation of \Blue Bloods\ https://t.co/TwH1IG8ZAm
1787555994643419557,FoxNews,Mon May 06 18:52:14 +0000 2024,Jake Paul says he has to \end\ Mike Tyson as summer fight is sanctioned https://t.co/IixiyhNf2t
1787556690935574677,CBSNews,Mon May 06 18:55:00 +0000 2024,Calcea Johnson and Ne\Kiya Jackson surprised the math world when, as seniors in high school, they produced innovative solutions to a 2,000-year-old puzzle.\n https://t.co/ZcxViRE0YQ
1787557947683524753,FoxNews,Mon May 06 19:00:00 +0000 2024,\GOOD BOY!\: K-9 Mercury hailed by community as a local hero after finding a missing 85-year-old woman who was found clinging to a tree down a steep ravine. https://t.co/GrcL6b2Ziq
1787558558013202641,FoxNews,Mon May 06 19:02:26 +0000 2024,NY v. Trump: DA\s witness testifies Trump did not direct him on Cohen repayments https://t.co/hEVAG4xLMB
1787560608629477639,FoxNews,Mon May 06 19:10:35 +0000 2024,Aaron Hernandez’s fiancée rips jokes made about late tight end on Tom Brady roast special https://t.co/T6ymtpjTgC
1787562771300733141,FoxNews,Mon May 06 19:19:10 +0000 2024,GWU law professor calls on anti-Israel students to leave \mommy and daddy\ paid dorm rooms, go to Gaza https://t.co/nqlzDV1nlL
1787563360608833953,CBSNews,Mon May 06 19:21:31 +0000 2024,Hamas says that it approves of a cease-fire proposal presented by Egypt and Qatar, according to a statement on a Palestinian news site. https://t.co/1PrUEeTBcM
