id_str,posted_by,created_at,full_text
1771811285631393800,CNN,Sun Mar 24 08:08:23 +0000 2024,Nearly 300 schoolchildren kidnapped in Nigeria earlier this month have been released, governor says https://t.co/hSQwknbaRE
1771989978458775647,CNN,Sun Mar 24 19:58:27 +0000 2024,New Jersey first lady Tammy Murphy is suspending her campaign for Senate seat held by Sen. Bob Menendez, a source says. https://t.co/LaAfmT6bFC
1772241588850200876,CNN,Mon Mar 25 12:38:16 +0000 2024,Boeing CEO Dave Calhoun plans to step down at the end of the year. The company\s chairman and head of the commercial airplane unit are also leaving. https://t.co/cXggfMEGVq
1772279013567795430,CNN,Mon Mar 25 15:06:58 +0000 2024,Trump appears in court for a hearing in the NY hush money case as he also faces a deadline to post a multimillion-dollar bond in his civil fraud case https://t.co/yeF7LATiS4 https://t.co/9TxNGhcUlw
1772279028709212646,CNN,Mon Mar 25 15:07:02 +0000 2024,The UN Security Council passes a resolution calling for an immediate ceasefire in Gaza after the US abstains https://t.co/5bC16iViZU
1772287077628940349,CNN,Mon Mar 25 15:39:01 +0000 2024,Court says Trump has to post $175 million in 10 days to meet terms of a $464 million civil fraud judgment, giving the former president a lifeline https://t.co/0B735yipK9
1772293889459683429,CNN,Mon Mar 25 16:06:05 +0000 2024,A court clerk accused of jury tampering in the Alex Murdaugh murder case resigns months after a judge ruled the allegations didn\t merit a new trial https://t.co/lnb8fjbfmE
1772300921864659068,CNN,Mon Mar 25 16:34:02 +0000 2024,Trump\s New York criminal trial on charges related to hush money payments to Stormy Daniels will begin on April 15 with jury selection, judge says https://t.co/iI4I1HWgbk
1772375748357107953,CNN,Mon Mar 25 21:31:22 +0000 2024,Sean \Diddy\ Combs\ homes in California and Florida raided as part of an ongoing investigation, Homeland Security tells CNN https://t.co/y9suax9jtk
1772385417469235689,CNN,Mon Mar 25 22:09:47 +0000 2024,Shohei Ohtani says he never gambled on sports or asked anyone to do it for him as scandal involving baseball star\s former interpreter swirls https://t.co/pf5CIp2jdz
1772526804114276841,CNN,Tue Mar 26 07:31:36 +0000 2024,Baltimore bridge collapses after being struck by large ship, according to video obtained by CNN https://t.co/nVMalEli1D
1772553650948206772,CNN,Tue Mar 26 09:18:17 +0000 2024,Rescuers in Baltimore searching for multiple people who may have fallen into the Patapsco River as a major bridge collapsed, official tells CNN. Follow live updates. https://t.co/sWpPZ73J9F
1772578136737112121,CNN,Tue Mar 26 10:55:35 +0000 2024,Jailed WikiLeaks founder Julian Assange staves off immediate extradition on espionage charges as UK court demands assurances from US https://t.co/u1qDpis5Hl
1772578368875016468,CNN,Tue Mar 26 10:56:30 +0000 2024,Two people have been rescued from the water after a Baltimore bridge collapse. The city\s fire chief says it remains a search-and-rescue effort. https://t.co/USWcKk7rOw
1772643069210370208,CNN,Tue Mar 26 15:13:36 +0000 2024,The crew of the ship that collided with the Baltimore bridge warned of power issues and issued a \mayday\ prior to the collapse, Maryland governor says https://t.co/RettJnLasQ
1772673034991587394,CNN,Tue Mar 26 17:12:40 +0000 2024,President Biden says he wants the US government to bear the cost of rebuilding Baltimore\s Francis Scott Key bridge that collapsed after it was struck by a ship https://t.co/lCNGsr10SZ
1772700008778715483,CNN,Tue Mar 26 18:59:51 +0000 2024,A judge imposed a gag order on Trump, limiting him from making statements about potential witnesses in the trial relating to hush money payments. https://t.co/nL0GWX2iwW
1772712771018162346,CNN,Tue Mar 26 19:50:34 +0000 2024,Independent presidential candidate Robert F. Kennedy Jr. has announced attorney and entrepreneur Nicole Shanahan as his running mate https://t.co/I1M7hFBKsB https://t.co/qqD3JwSRl5
1772726881197937142,CNN,Tue Mar 26 20:46:38 +0000 2024,Truth Social owner Trump Media closes 16% higher on its first day on Wall Street, lifting the value of Trump\s stake to about $4.6 billion.\nhttps://t.co/JpYlGbuduP
1772742349858226529,CNN,Tue Mar 26 21:48:06 +0000 2024,A majority of Supreme Court justices appeared skeptical of the idea of a nationwide ban or new limits on mifepristone, the primary drug used for medication abortions. https://t.co/kWTwCrfCfk
1772751864527749284,CNN,Tue Mar 26 22:25:55 +0000 2024,NBC News ousts former RNC chair Ronna McDaniel, days after her hiring sparked intense backlash from the network\s top television anchors \nhttps://t.co/Cg9lc9FHOU
1772770305951273002,CNN,Tue Mar 26 23:39:12 +0000 2024,Six people are presumed dead after Baltimore bridge collapse. The Coast Guard is ending its active search and rescue operation. \nhttps://t.co/5fXyZVQbnQ
1772823584374759635,CNN,Wed Mar 27 03:10:54 +0000 2024,Artist Richard Serra, whose monumental abstract sculptures transformed museums and public spaces, has died at 85. https://t.co/JH9G86VwmB
1772955249499570565,CNN,Wed Mar 27 11:54:06 +0000 2024,Federal appeals court rules controversial Texas immigration law will remain on hold while legal challenges play out https://t.co/osQ1oJDMVo
1773022397416739268,CNN,Wed Mar 27 16:20:55 +0000 2024,Disney and Florida settle a dispute that arose over opposition to state law restricting instruction about gender and sexual orientation in classrooms\nhttps://t.co/sbZVBLk4dB
1773109949997924850,CNN,Wed Mar 27 22:08:49 +0000 2024,Former Democratic vice presidential nominee and Sen. Joe Lieberman has died at 82, according to a statement from his family https://t.co/PChJPJfxzq https://t.co/fqdEFlHPzm
1773112452281974940,CNN,Wed Mar 27 22:18:46 +0000 2024,JUST IN: Officials have recovered the bodies of two of the missing workers who were on the Francis Scott Key Bridge when it collapsed, police say https://t.co/ktVvDLi5Ei
1773133550834835727,CNN,Wed Mar 27 23:42:36 +0000 2024,JUST IN: An attorney discipline judge in California has recommended that ex-Trump election lawyer John Eastman be disbarred, according to an opinion released on Wednesday. The California Supreme Court will have the final say. https://t.co/BfIDUVqg8G
1773145757937258934,CNN,Thu Mar 28 00:31:06 +0000 2024,Conservative bigwig Matt Schlapp agreed to hefty settlement to end sexual assault lawsuit https://t.co/Lw26xik3cl
1773352721111744803,CNN,Thu Mar 28 14:13:30 +0000 2024,RT @CNNPolitics: A hearing is underway in Fulton County over whether the charges in the Georgia election case against former President Dona…
1773378425350213909,CNN,Thu Mar 28 15:55:39 +0000 2024,Sam Bankman-Fried is sentenced to 25 years in prison for his role in the collapse of crypto exchange FTX https://t.co/OvBqrjk3VI
1773396698640892212,CNN,Thu Mar 28 17:08:15 +0000 2024,House speaker plans to send impeachment articles against the Homeland Security secretary to the Senate on April 10 https://t.co/w4cRDcqxvY
1773426570826227792,CNN,Thu Mar 28 19:06:57 +0000 2024,The Biden administration strengthened protections of the Endangered Species Act, repealing Trump-era rules that had stripped safeguards for plants and animals that are threatened by human development and the climate crisis. https://t.co/LqVkAaqDnJ
1773445762489131388,CNN,Thu Mar 28 20:23:13 +0000 2024,The S&amp;P 500 just turned in its best first quarter since 2019, even as Wall Street contended with higher-for-longer interest rates https://t.co/iYSJ0KQqM9
1773448307949400431,CNN,Thu Mar 28 20:33:20 +0000 2024,45 people killed as a bus carrying Easter worshippers falls off a cliff in South Africa https://t.co/uA0xNGbVSq
1773712811463500054,CNN,Fri Mar 29 14:04:22 +0000 2024,Louis Gossett Jr., a star of film and television who won an Academy Award for his performance in \An Officer and a Gentleman,\ has died, according to his family. He was 87. https://t.co/zvvLzZiMyU https://t.co/gikIJPS1Fx
1773798967089725940,CNN,Fri Mar 29 19:46:44 +0000 2024,Trump and several of his co-defendants appeal ruling that let Fulton County DA Fani Willis remain on the Georgia election subversion case.\nhttps://t.co/fPFIye8ZzY
1774380518668173450,CNN,Sun Mar 31 10:17:36 +0000 2024,King Charles III has made his most significant outing since his cancer diagnosis last month, attending the traditional Easter Mattins church service in Windsor. https://t.co/6Su2GJX8UN
1774396805351866849,CNN,Sun Mar 31 11:22:19 +0000 2024,Pope Francis presides over Easter Mass amid concerns over his health and addresses conflicts in Europe and the Middle East, calling for a ceasefire in Gaza. https://t.co/30mdi77eZZ
1774442254695887203,CNN,Sun Mar 31 14:22:55 +0000 2024,Israeli Prime Minister Benjamin Netanyahu is to undergo surgery after being diagnosed with a hernia. Yariv Levin will temporarily act as PM. https://t.co/gqm3HEafZC
1774678948284117314,CNN,Mon Apr 01 06:03:27 +0000 2024,Israeli military withdraws from Gaza\s Al-Shifa hospital after 14-day siege, Gaza officials say. Follow live updates. https://t.co/7lSR2UiYuH
1774822532899631423,CNN,Mon Apr 01 15:34:01 +0000 2024,Alex Murdaugh is sentenced in federal court to 40 years in prison for financial crimes https://t.co/5nWjOvFmAl
1774839404437164434,CNN,Mon Apr 01 16:41:03 +0000 2024,Tonight\s Powerball jackpot reaches $1 billion after no grand prize winner Saturday https://t.co/lfzNwiYvlF
1774851758491123911,CNN,Mon Apr 01 17:30:09 +0000 2024,Iran has accused Israel of killing a top commander in its Revolutionary Guard in an airstrike on its consulate building in Syria https://t.co/QDpCLJjTzO
1774895621436027046,CNN,Mon Apr 01 20:24:26 +0000 2024,Biden administration set to greenlight sale of American-made F-15 fighter jets to Israel in a deal expected to be worth over $18 billion, sources say https://t.co/Bqo1JBAEo8
1774902947890995369,CNN,Mon Apr 01 20:53:33 +0000 2024,JUST IN: The Florida Supreme Court upheld the state\s existing restrictions on abortions but cleared the way for abortion access to be on the ballot this fall https://t.co/tTphMaxQro
1774908268894179629,CNN,Mon Apr 01 21:14:42 +0000 2024,The Manhattan district attorney’s office asked the judge overseeing Donald Trump’s criminal trial related to hush money payments to expand the gag order to stop the former president from attacking family members of people involved in the case https://t.co/VWSya8R3Zp
1774959711986614520,CNN,Tue Apr 02 00:39:07 +0000 2024,The judge overseeing Donald Trump\s criminal hush money trial expanded a recently imposed gag order to include family members of the court and family members of the Manhattan district attorney, according to a late Monday ruling. https://t.co/PNexDiE3Ml
1774964989314355645,CNN,Tue Apr 02 01:00:05 +0000 2024,A federal judge has denied Hunter Biden’s attempts to throw out his felony tax indictment, paving the way for a trial in June https://t.co/d2T6KIyebp
1774967508069442025,CNN,Tue Apr 02 01:10:05 +0000 2024,Former President Donald Trump has posted a $175 million bond as he appeals the judgment against him in the New York civil fraud case brought by state Attorney General Letitia James. https://t.co/YPYQGkBK2S
1774975480921231653,CNN,Tue Apr 02 01:41:46 +0000 2024,At least 5 people working with World Central Kitchen non-profit have been killed in an Israeli attack in Gaza, group founder José Andrés says https://t.co/lHNurX5hg0
1775114148096913665,CNN,Tue Apr 02 10:52:47 +0000 2024,A child has died and two others have been seriously injured in a school shooting in Finland, according to police https://t.co/Kqwp3AUqUM
1775141124056752297,CNN,Tue Apr 02 12:39:59 +0000 2024,Netanyahu says Israel \unintentionally struck innocent people\ after an airstrike in Gaza killed at least 7 aid workers, including foreign nationals https://t.co/lBxCfwYWRn
1775157416880902330,CNN,Tue Apr 02 13:44:43 +0000 2024,Tesla posts its first annual drop in sales since 2020 amid growing electric vehicle competition from Chinese and Western automakers https://t.co/14ObbBPY5V
1775157762403520717,CNN,Tue Apr 02 13:46:06 +0000 2024,At least 27 people were killed in a fire at a nightclub undergoing repairs in Istanbul, Turkey, state media says https://t.co/jo2oBSvRpu
1775189815245332746,CNN,Tue Apr 02 15:53:28 +0000 2024,Biden spoke with Chinese President Xi Jinping on the phone today, their first conversation since a November summit amid global tensions\nhttps://t.co/zXadcOqNHj
1775323378947100851,CNN,Wed Apr 03 00:44:12 +0000 2024,A 7.4-magnitude earthquake strikes off Taiwan\s eastern coast, sparking tsunami warning in Japan\nhttps://t.co/cY5Ds126Vf
1775341897474588959,CNN,Wed Apr 03 01:57:47 +0000 2024,Military scrambles to help with disaster relief after biggest quake in 25 years hits Taiwan.\n\nFollow live updates. https://t.co/OywW9t45vH
1775557297793532321,CNN,Wed Apr 03 16:13:42 +0000 2024,Attorney defending Texas\s controversial immigration law in federal court says the state may have gone \too far\ https://t.co/a1KIa3OFFD
1775567804176990464,CNN,Wed Apr 03 16:55:27 +0000 2024,Two investors plead guilty in insider trading scheme linked to the Trump Media deal that brought the former president\s social media business public https://t.co/KzTveRO0Jx
1775580026320142785,CNN,Wed Apr 03 17:44:01 +0000 2024,Disney and CEO Bob Iger prevailed in a high-profile fight against activist investors who sought to win seats on the company\s board of directors https://t.co/Yl6BTmifhd
1775585288049381553,CNN,Wed Apr 03 18:04:56 +0000 2024,Basketball star Angel Reese announces she\s leaving LSU for the WNBA, two days after her team lost to Iowa in the Elite Eight of the NCAA tournament.\nhttps://t.co/tpmj7uy8Jh
1775591591140266090,CNN,Wed Apr 03 18:29:58 +0000 2024,Benny Gantz, one of Israeli Prime Minister Netanyahu\s most vocal critics from within his war cabinet, publicly calls for early elections in September. https://t.co/EYf3SOSyVi
1775634605845954608,CNN,Wed Apr 03 21:20:54 +0000 2024,Judge denies Trump\s motion to delay his New York hush money trial until after the Supreme Court rules on presidential immunity. https://t.co/dTQg1wBxeW
1775897008022413644,CNN,Thu Apr 04 14:43:35 +0000 2024,Biden administration recently authorized more bombs for Israel, despite growing concerns over war in Gaza\nhttps://t.co/3qcfW4jjy7
1775922543745978620,CNN,Thu Apr 04 16:25:04 +0000 2024,President Biden and Israeli Prime Minister Benjamin Netanyahu speak for the first time since Israel\s deadly strike on a convoy of aid workers in Gaza https://t.co/vADdutCF6U
1775929573005205856,CNN,Thu Apr 04 16:53:00 +0000 2024,An Atlanta-area judge has upheld the criminal indictment against former President Donald Trump in Georgia, rejecting the argument that Trump’s efforts to overturn the 2020 election were protected under the First Amendment. https://t.co/ewpo4QBrDl
1775952089450999867,CNN,Thu Apr 04 18:22:28 +0000 2024,President Biden told Israeli Prime Minister Benjamin Netanyahu the humanitarian situation in Gaza is unacceptable and warned Israel to address the crisis or face consequences https://t.co/LYBIkQDlqG
1775954987945730111,CNN,Thu Apr 04 18:33:59 +0000 2024,Lawyers for defendants in the criminal case against Donald Trump are considering whether to seek a gag order against Fulton County District Attorney Fani Willis, sources say https://t.co/VgWueWlHD6
1775963858689028402,CNN,Thu Apr 04 19:09:14 +0000 2024,No Labels will not field a third-party presidential unity ticket in 2024 https://t.co/HHwV8i4Rfb
1775965660989812945,CNN,Thu Apr 04 19:16:24 +0000 2024,JUST IN: Judge Aileen Cannon rejects Donald Trump\s bid to dismiss criminal charges in classified documents case https://t.co/i6qrvqYWwB
1776028345932607763,CNN,Thu Apr 04 23:25:29 +0000 2024,Israeli cabinet approves reopening of Erez crossing for the first time since October 7, allowing more aid to enter Gaza, official says https://t.co/paqXCZIFge
1776200122948309378,CNN,Fri Apr 05 10:48:04 +0000 2024,Israel dismisses two military officers as a report finds the deadly strike on aid workers was due to \mistaken identification\ and \errors in decision-making.\ \n\nRead more: https://t.co/9bLBD7ukV7 https://t.co/qc6CvetQfn
1776227648152256661,CNN,Fri Apr 05 12:37:26 +0000 2024,The US economy added 303,000 positions in March, a much higher number than anticipated \nhttps://t.co/XpIeB01dvG
1776261336235704666,CNN,Fri Apr 05 14:51:18 +0000 2024,Earthquake with preliminary magnitude of 4.7 felt in the northeastern US, according to the US Geological Survey https://t.co/NpPYDF9vck
1776378669939736882,CNN,Fri Apr 05 22:37:33 +0000 2024,An aftershock of a preliminary magnitude 4.0 has struck New Jersey, USGS says.\n\nFollow live updates. https://t.co/D5E1irIEXW
1776942448167489899,CNN,Sun Apr 07 11:57:48 +0000 2024,Israel says it has withdrawn from Khan Younis in southern Gaza after months of fighting, while \significant force\ remains in other areas of the strip https://t.co/Sq0yZF6YaJ
1777082969355669858,CNN,Sun Apr 07 21:16:11 +0000 2024,South Carolina finishes the season undefeated after beating Iowa in the championship game, the final college game for Hawkeyes star Caitlin Clark. https://t.co/7BK73eMnDD
1777128377457037314,CNN,Mon Apr 08 00:16:37 +0000 2024,A Russian-controlled nuclear power plant in Ukraine was damaged in a drone attack, the facility is still safe, UN nuclear agency says. https://t.co/KVuUdi7TuC
1777306605614219383,CNN,Mon Apr 08 12:04:50 +0000 2024,Former President Trump says abortion legislation should be left to the states and does not say at what number of weeks he would support a ban. https://t.co/ODcGvQgo9o
1777350393573396740,CNN,Mon Apr 08 14:58:50 +0000 2024,Jonathan Majors will not serve jail time for assaulting an ex-girlfriend. The former Marvel star must attend a domestic violence intervention program. https://t.co/ks7YLv106G
1777378877960065029,CNN,Mon Apr 08 16:52:01 +0000 2024,JUST IN: Donald Trump\s legal team appeals gag order on the former president and seeks a change of venue a week before the Manhattan hush money trial is set to begin https://t.co/ueZBErkPM4
1777383068782743683,CNN,Mon Apr 08 17:08:40 +0000 2024,A partial eclipse is now visible in Mexico. Watch and follow live updates as the celestial event also crosses the United States and Canada. https://t.co/JBz7X80yV4
1777398429523534222,CNN,Mon Apr 08 18:09:42 +0000 2024,Some people in Mexico are getting a look at the first totality of today\s solar eclipse. Watch the rare spectacle. https://t.co/4SbEZcQZsp
1777410797624234483,CNN,Mon Apr 08 18:58:51 +0000 2024,Get your certified glasses ready. The total solar eclipse is crossing the United States. https://t.co/5ZBJc6U67i
1777416271237136513,CNN,Mon Apr 08 19:20:36 +0000 2024,The total solar eclipse is crossing the East Coast. See it from Niagara Falls, New York. https://t.co/TBNvXK9tdA
1777427926939574307,CNN,Mon Apr 08 20:06:55 +0000 2024,Two people were killed and a male suspect is dead after a shooting at a law office in Las Vegas, police say https://t.co/PPJXSSDDUp
1777454196683346133,CNN,Mon Apr 08 21:51:18 +0000 2024,Judge denies Trump\s request to postpone trial and consider venue change in hush money case https://t.co/Pf1wg0z1YP
1777467900984541434,CNN,Mon Apr 08 22:45:46 +0000 2024,JUST IN: Tesla has settled a wrongful death suit filed by the family of an Apple engineer who died after his car crashed while on Autopilot https://t.co/6jh2PUiEEf
1777541429037851043,CNN,Tue Apr 09 03:37:56 +0000 2024,Connecticut repeats as national champion with a victory over Purdue in the men\s basketball title game. https://t.co/bw6KpnZSFq
1777678004845477897,CNN,Tue Apr 09 12:40:38 +0000 2024,Norfolk Southern reaches $600 million settlement to resolve all class action lawsuits within 20 miles of last year\s East Palestine, Ohio, derailment https://t.co/S7al9l17bq
1777680819294765379,CNN,Tue Apr 09 12:51:49 +0000 2024,Video and eyewitness testimonies cast doubt on Israel\s account of how a Gaza aid delivery in February turned deadly https://t.co/0ZsdgK6Ckk
1777737221459632476,CNN,Tue Apr 09 16:35:57 +0000 2024,Supreme Court won\t halt today\s execution of a Missouri death row inmate despite scores of correctional officers supporting his clemency petition https://t.co/wwm7LexAJW
1777743653181562993,CNN,Tue Apr 09 17:01:30 +0000 2024,An appeals court judge has denied former President Donald Trump’s request to delay the start of his New York hush money trial so he can challenge the gag order imposed by Judge Juan Merchan. https://t.co/CMW5Bb0pup
1777748072467960222,CNN,Tue Apr 09 17:19:04 +0000 2024,The first parents to be held criminally responsible for a mass school shooting committed by their child were each sentenced to 10-15 years in prison https://t.co/ut18kBbe65 https://t.co/v2Dk4eovuN
1777756056371790240,CNN,Tue Apr 09 17:50:47 +0000 2024,In a historic decision, the Arizona Supreme Court has ruled that the state must adhere to a 123-year-old penal code provision barring all abortions except in cases when “it is necessary to save” a pregnant person’s life. https://t.co/OS406MaNkk https://t.co/QeeS310ivz
1777774830701396329,CNN,Tue Apr 09 19:05:23 +0000 2024,The FAA is investigating Boeing after a whistleblower repeatedly raised concerns with two jet models and claimed the company retaliated against him https://t.co/Iu8cHsadot
1777789698984784052,CNN,Tue Apr 09 20:04:28 +0000 2024,The Biden administration is preparing to prevent US companies and citizens from using software made by a Russian firm over security concerns, officials say https://t.co/Mevm7dBBVX
1777795640182882329,CNN,Tue Apr 09 20:28:05 +0000 2024,House to delay sending impeachment articles against Homeland Security Secretary Mayorkas to the Senate until next week https://t.co/ZRj1RGBZ4N
1777840015579459997,CNN,Tue Apr 09 23:24:25 +0000 2024,Missouri executes death row inmate Brian Dorsey for the 2006 murders of his cousin and her husband after his mercy bid failed https://t.co/GOOsNfHwE6
1777844704194777331,CNN,Tue Apr 09 23:43:02 +0000 2024,For the first time in its 42-year history, more people watched the women’s NCAA basketball final than the men’s. https://t.co/0mzPLwcE31
1777988818626359786,CNN,Wed Apr 10 09:15:42 +0000 2024,The Biden administration has finalized a national standard to limit dangerous \forever chemicals\ found in nearly half of the drinking water in the US https://t.co/BIQqhFVySU
1778039128786915797,CNN,Wed Apr 10 12:35:37 +0000 2024,Hamas tells negotiators it doesn\t have 40 living Israeli hostages needed for the first phase of a ceasefire deal, sources say\nhttps://t.co/uY8OqDSR3k
1778045778658750525,CNN,Wed Apr 10 13:02:02 +0000 2024,Rising gas prices and stubbornly high housing costs in March sent US consumer prices rising more than expected, new data shows https://t.co/ta2a9GY9sV
1778065332671844483,CNN,Wed Apr 10 14:19:44 +0000 2024,Ex-Trump Organization CFO Allen Weisselberg is sentenced to five months in jail after committing perjury in the former president\s civil fraud case https://t.co/jsF0X610KI
1778067933861687328,CNN,Wed Apr 10 14:30:04 +0000 2024,First of six ex-Mississippi officers who pleaded guilty in \Goon Squad\ torture of two Black men is sentenced on state charges. Follow live updates. https://t.co/x3WJPUnHcT
1778083047843180995,CNN,Wed Apr 10 15:30:08 +0000 2024,Trump\s lawyers file new appeal in his New York hush money case, challenging a judge\s order denying him from arguing he has presidential immunity. https://t.co/xfMVI8MyiL
1778102905372848351,CNN,Wed Apr 10 16:49:02 +0000 2024,Independent presidential candidate Cornel West names Melina Abdullah, a pan-African studies professor at California State University, as his VP pick https://t.co/ZmvcobHDru
1778123286183883080,CNN,Wed Apr 10 18:10:02 +0000 2024,Former President Donald Trump said he would not sign a federal abortion ban if one reached his desk were he to be elected in November. https://t.co/oVPjHOH16m
1778126525646188969,CNN,Wed Apr 10 18:22:54 +0000 2024,Florida Gov. Ron DeSantis told donors over the weekend he would help raise money for former presidential rival Donald Trump, sources say https://t.co/4UymMlqsiR
1778127999843377300,CNN,Wed Apr 10 18:28:45 +0000 2024,House Speaker Mike Johnson is dealt another blow with the defeat of a procedural vote after Donald Trump called on Republicans to kill a surveillance bill https://t.co/OBMliazYLX
1778153540218740801,CNN,Wed Apr 10 20:10:15 +0000 2024,US stocks end the day sharply down, with the Dow losing 422 points, after inflation data came in hotter than expected https://t.co/tdwAJEDrZV
1778158805932528045,CNN,Wed Apr 10 20:31:10 +0000 2024,Four people are in custody and several firearms have been recovered after a shooting in West Philadelphia left multiple people injured, sources say https://t.co/7tQQeGsuqS
1778176930484814247,CNN,Wed Apr 10 21:43:11 +0000 2024,For the third time in three days, a New York appeals court judge has denied an attempt by former President Donald Trump to delay his hush money trial https://t.co/sk1joE4IYb
1778403739792969807,CNN,Thu Apr 11 12:44:27 +0000 2024,Another key US inflation gauge showed prices ticked up last month, putting more pressure on businesses and consumers https://t.co/V2rvpiHtsw
1778440314539196675,CNN,Thu Apr 11 15:09:47 +0000 2024,O.J. Simpson, the former NFL star whose athletic achievements and fame were eclipsed by his 1995 acquittal in the brutal killings of his ex-wife Nicole Brown Simpson and her friend Ron Goldman, has died of cancer, his family announced. He was 76. https://t.co/KkUWtVXCVT https://t.co/eD4q62GKYT
1778472035779244283,CNN,Thu Apr 11 17:15:50 +0000 2024,More than 100 cases of measles have been reported in the US since the start of the year, and the CDC warns that a rapid rise in cases – significantly more than in recent years – poses a renewed threat to the country’s disease elimination status. https://t.co/wsg2QLCl21
